{
  "version": "1.1.0",
  "fuente": "FODA_Export_Misiones_2026_DEMO.xlsx",
  "escalas": {
    "situacion": [
      "No corresp.",
      "Muy Desfav.",
      "Desfavorable",
      "Favorable",
      "Muy Favorable"
    ],
    "impacto": [
      "Muy insignif",
      "Insignificante",
      "Significante",
      "Muy Signific."
    ]
  },
  "areasInternas": [
    {
      "id": "IA",
      "nombre": "Segmentos de clientes",
      "tipo": "interno",
      "marco": "Canvas — Segmentos de clientes",
      "items": [
        {
          "id": "IA1",
          "orden": 1,
          "titulo": "Definición de segmentos y países objetivo",
          "criterioFavorable": "Se considera favorable si la empresa tiene definidos, con datos, los tipos de cliente externo (importador, distribuidor, industria, retail) y los 2 o 3 países prioritarios.",
          "preguntaEntrevista": "¿A qué tipo de clientes y en qué países querría vender? ¿Con qué datos lo decidió?",
          "evidenciaSugerida": "Lista de países y segmentos priorizados; estudio o fuente consultada.",
          "quienResponde": "Empresario: datos de cartera y experiencia actuales. Estudiante: investigación de países y segmentos candidatos, a validar con el empresario.",
          "lecturaSinExportar": "Favorable si, aunque nunca exportó, el equipo ya identificó con datos 2-3 países/segmentos candidatos (puede ser trabajo del estudiante avalado por el empresario). Si no hay ese trabajo previo, es Desfavorable real, no 'No corresponde'.",
          "clasificacionMarco": {
            "tipo": "Canvas puro",
            "bloquePrincipal": "Segmentos de clientes",
            "bloqueSecundario": null,
            "nota": null
          },
          "filaFormularioFoda": 6
        },
        {
          "id": "IA2",
          "orden": 2,
          "titulo": "Conocimiento de las necesidades del cliente externo",
          "criterioFavorable": "Se considera favorable si la empresa conoce qué exige el comprador del exterior (calidad, volumen, plazos, formatos, certificaciones) y no solo lo que pide el mercado interno.",
          "preguntaEntrevista": "¿Qué le exigiría un comprador de Brasil, Paraguay u otro destino que hoy no le piden en Argentina?",
          "evidenciaSugerida": "Consultas o cotizaciones recibidas del exterior; fichas de requisitos.",
          "quienResponde": "Empresario: datos de cartera y experiencia actuales. Estudiante: investigación de países y segmentos candidatos, a validar con el empresario.",
          "lecturaSinExportar": "Sin exportar, esto casi siempre será Desfavorable o Muy desfavorable: es una brecha real de información, regístrela así en vez de neutralizarla.",
          "clasificacionMarco": {
            "tipo": "Canvas puro",
            "bloquePrincipal": "Segmentos de clientes",
            "bloqueSecundario": null,
            "nota": null
          },
          "filaFormularioFoda": 7
        },
        {
          "id": "IA3",
          "orden": 3,
          "titulo": "Concentración de clientes",
          "criterioFavorable": "Se considera favorable si ningún cliente supera el 40% de las ventas y la cartera está balanceada entre mercado interno y potencial externo.",
          "preguntaEntrevista": "¿Qué porcentaje de las ventas representa su mayor cliente? ¿Y los tres mayores?",
          "evidenciaSugerida": "Ranking de clientes por facturación del último año.",
          "quienResponde": "Empresario: datos de cartera y experiencia actuales. Estudiante: investigación de países y segmentos candidatos, a validar con el empresario.",
          "lecturaSinExportar": "No cambia: se responde con la cartera de clientes doméstica actual, exporte o no la empresa.",
          "clasificacionMarco": {
            "tipo": "Canvas puro",
            "bloquePrincipal": "Segmentos de clientes",
            "bloqueSecundario": null,
            "nota": null
          },
          "filaFormularioFoda": 8
        },
        {
          "id": "IA4",
          "orden": 4,
          "titulo": "Experiencia previa exportadora",
          "criterioFavorable": "Se considera favorable si la empresa ya exportó (aunque sea de forma esporádica o indirecta, vía un tercero) o cotizó operaciones al exterior.",
          "preguntaEntrevista": "¿Exportó directa o indirectamente, o cotizó alguna vez a un cliente del exterior? ¿Qué aprendió?",
          "evidenciaSugerida": "Facturas de exportación, permisos de embarque o cotizaciones.",
          "quienResponde": "Empresario: datos de cartera y experiencia actuales. Estudiante: investigación de países y segmentos candidatos, a validar con el empresario.",
          "lecturaSinExportar": "Si nunca exportó ni cotizó, marque Muy Desfavorable con naturalidad: es la respuesta correcta, no un fracaso del formulario. Su Impacto suele ser menor en un primer proyecto acompañado por una cámara, consorcio o la propia tecnicatura.",
          "clasificacionMarco": {
            "tipo": "Canvas puro",
            "bloquePrincipal": "Segmentos de clientes",
            "bloqueSecundario": null,
            "nota": null
          },
          "filaFormularioFoda": 9
        },
        {
          "id": "IA5",
          "orden": 5,
          "titulo": "Acceso a información de mercados",
          "criterioFavorable": "Se considera favorable si la empresa consulta fuentes sistemáticas (estadísticas de comercio, cámaras, agencias de promoción, consulados) para elegir destinos y precios.",
          "preguntaEntrevista": "¿De dónde obtiene información sobre precios, demanda y competidores en el exterior?",
          "evidenciaSugerida": "Fuentes o informes utilizados; suscripciones o contactos institucionales.",
          "quienResponde": "Empresario: datos de cartera y experiencia actuales. Estudiante: investigación de países y segmentos candidatos, a validar con el empresario.",
          "lecturaSinExportar": "Evalúe con lo que el empresario y el equipo estudiante ya reunieron a la fecha de la entrevista, aunque sea incipiente.",
          "clasificacionMarco": {
            "tipo": "Canvas puro",
            "bloquePrincipal": "Segmentos de clientes",
            "bloqueSecundario": null,
            "nota": null
          },
          "filaFormularioFoda": 10
        }
      ]
    },
    {
      "id": "IB",
      "nombre": "Propuesta de valor",
      "tipo": "interno",
      "marco": "Canvas — Propuesta de valor",
      "items": [
        {
          "id": "IB1",
          "orden": 1,
          "titulo": "Diferenciación del producto",
          "criterioFavorable": "Se considera favorable si el producto tiene atributos diferenciales (calidad, diseño, especie o variedad, proceso, origen) que el cliente externo reconoce y valora.",
          "preguntaEntrevista": "¿Por qué un comprador del exterior le compraría a usted y no a otro proveedor?",
          "evidenciaSugerida": "Fichas técnicas, muestras, testimonios de clientes, premios.",
          "quienResponde": "Empresario, con apoyo del estudiante para comparar el producto contra los requisitos del destino elegido.",
          "lecturaSinExportar": "Se responde igual, exporte o no la empresa: use la evidencia doméstica disponible como capacidad transferible.",
          "clasificacionMarco": {
            "tipo": "Canvas puro",
            "bloquePrincipal": "Propuesta de valor",
            "bloqueSecundario": null,
            "nota": null
          },
          "filaFormularioFoda": 13
        },
        {
          "id": "IB2",
          "orden": 2,
          "titulo": "Adecuación a requisitos del mercado destino",
          "criterioFavorable": "Se considera favorable si el producto (norma técnica, envase, etiquetado, idioma, unidades) está adaptado como mínimo al 80% de lo que exige el destino elegido.",
          "preguntaEntrevista": "¿Qué cambios necesitaría el producto, el envase o la etiqueta para venderse en el país objetivo?",
          "evidenciaSugerida": "Comparación de requisitos del destino frente al producto actual.",
          "quienResponde": "Empresario, con apoyo del estudiante para comparar el producto contra los requisitos del destino elegido.",
          "lecturaSinExportar": "Se responde igual, exporte o no la empresa: use la evidencia doméstica disponible como capacidad transferible.",
          "clasificacionMarco": {
            "tipo": "Canvas puro",
            "bloquePrincipal": "Propuesta de valor",
            "bloqueSecundario": null,
            "nota": null
          },
          "filaFormularioFoda": 14
        },
        {
          "id": "IB3",
          "orden": 3,
          "titulo": "Certificaciones y normas de producto",
          "criterioFavorable": "Se considera favorable si la empresa posee, o tiene en trámite, las certificaciones que exige el destino (p. ej., FSC/PEFC, orgánico, BPM/HACCP, normas técnicas).",
          "preguntaEntrevista": "¿Qué certificaciones tiene vigentes y cuáles le piden sus clientes potenciales?",
          "evidenciaSugerida": "Certificados vigentes con fecha de vencimiento.",
          "quienResponde": "Empresario, con apoyo del estudiante para comparar el producto contra los requisitos del destino elegido.",
          "lecturaSinExportar": "Se responde igual, exporte o no la empresa: use la evidencia doméstica disponible como capacidad transferible.",
          "clasificacionMarco": {
            "tipo": "Canvas puro",
            "bloquePrincipal": "Propuesta de valor",
            "bloqueSecundario": null,
            "nota": null
          },
          "filaFormularioFoda": 15
        },
        {
          "id": "IB4",
          "orden": 4,
          "titulo": "Competitividad de precio internacional",
          "criterioFavorable": "Se considera favorable si el precio FOB estimado resulta competitivo frente al de los principales oferentes en el mercado destino.",